{"schema_version":"1.0","id":"hl_20260226_cf021288","created_at":"2026-02-26T10:21:09.408582+00:00","inputs":{"dataset_meta":"C:\\Users\\Clamps\\.openclaw\\workspace\\artifacts\\data\\hyperliquid\\ETH\\1h\\20250801T210000Z-20260226T060000Z.meta.json","dataset_csv":"C:\\Users\\Clamps\\.openclaw\\workspace\\artifacts\\data\\hyperliquid\\ETH\\1h\\20250801T210000Z-20260226T060000Z.csv","strategy_spec":"artifacts/strategy_specs/20260226/strategy-spec-20260226-3315d61e42cf.strategy_spec.json","variant":"directive_exploration"},"fee_model_hash":"e3cac4a495590a64d2bb89489eb18006328d5fd2586c2b957fc3e0461e5ed527","settings":{"entry_fill_rule":"bar_close","tie_break":"worst_case","fee_mode":"taker","fee_bps":4.5,"slippage_bps":1.0,"cost_config_path":"C:\\Users\\Clamps\\.openclaw\\workspace\\config\\backtest_costs.json","fee_model_hash":"e3cac4a495590a64d2bb89489eb18006328d5fd2586c2b957fc3e0461e5ed527"},"results":{"net_profit":-1879.36394248,"net_profit_pct":-0.18793639,"total_trades":226,"win_rate":0.30530973,"profit_factor":0.47456894,"max_drawdown":1879.36394248,"total_fees_paid":705.54027733,"total_slippage_cost_est":156.78671812,"start_ts":"2025-08-01T21:00:00+00:00","end_ts":"2026-02-26T06:00:00+00:00"},"coverage":{"bars_tested":5002,"time_in_market_pct":0.09356257,"avg_bars_in_trade":3.07079646,"entry_signals_seen":{"long":113,"short":113,"total":226},"entries_taken":226,"exits_taken":226},"gate":{"min_trades_required":0,"gate_pass":true,"gate_reason":"OK"}}